PT	AU	BA	BE	GP	AF	BF	CA	TI	SO	SE	BS	LA	DT	CT	CY	CL	SP	HO	DE	ID	AB	C1	RP	EM	RI	OI	FU	FX	CR	NR	TC	Z9	U1	U2	PU	PI	PA	SN	EI	BN	J9	JI	PD	PY	VL	IS	PN	SU	SI	MA	BP	EP	AR	DI	D2	EA	EY	PG	WC	SC	GA	UT	PM	OA	HC	HP	DA	
J	Lin, YN; Qiu, XL				Lin, Yanan; Qiu, Xiaolong			Classification of tilting bundles over a weighted projective line of type (2,3,3)	FRONTIERS OF MATHEMATICS IN CHINA			English	Article						Tilting bundle; tame concealed algebra; weighted projective line; vector bundle	ALGEBRAS	We give a complete classification of tilting bundles over a weighted projective line of type (2, 3, 3). This yields another realization of the tame concealed algebras of type E (6).	[Lin, Yanan; Qiu, Xiaolong] Xiamen Univ, Sch Math Sci, Xiamen 361005, Peoples R China	Qiu, XL (reprint author), Xiamen Univ, Sch Math Sci, Xiamen 361005, Peoples R China.	xlqiu86@sina.com			National Natural Science Foundation of China [11471269]	The authors would like to thank the referees for the detailed comments. This work was supported in part by the National Natural Science Foundation of China (Grant No. 11471269).		10	0	0	0	0	HIGHER EDUCATION PRESS	BEIJING	SHATANHOU ST 55, BEIJING 100009, PEOPLES R CHINA	1673-3452	1673-3576		FRONT MATH CHINA	Front. Math. China	OCT	2015	10	5					1147	1167		10.1007/s11464-015-0472-0				21	Mathematics	Mathematics	CJ8LC	WOS:000355750900008					2019-08-07	
J	Tan, Q; Xu, HF				Tan, Qiang; Xu, Haifeng			Lefschetz decomposition for de Rham cohomology on weakly Lefschetz symplectic manifolds	FRONTIERS OF MATHEMATICS IN CHINA			English	Article						Symplectic manifold; s-Lefschetz; Lefschetz decomposition; s-dd(Lambda)-lemma		For a compact symplectic manifold which is s-Lefschetz which is weaker than the hard Lefschetz property, we prove that the Lefschetz decomposition for de Rham cohomology also holds.	[Tan, Qiang] Wuhan Univ, Sch Math & Stat, Wuhan 430072, Peoples R China; [Xu, Haifeng] Yangzhou Univ, Sch Math Sci, Yangzhou 225002, Jiangsu, Peoples R China	Tan, Q (reprint author), Wuhan Univ, Sch Math & Stat, Wuhan 430072, Peoples R China.	tanqiang1986@hotmail.com			National Natural Science Foundation of China [11371309, 11471145, 11401514]; University Science Research Project of Jiangsu Province [14KJB110027]; Foundation of Yangzhou University [2014CXJ004]	The authors were very grateful to their advisor Prof. Hongyu Wang for discussion and suggestions. This work was supported in part by the National Natural Science Foundation of China (Grant Nos. 11371309, 11471145, 11401514), the University Science Research Project of Jiangsu Province (14KJB110027), and the Foundation of Yangzhou University (2014CXJ004).		15	0	0	0	0	HIGHER EDUCATION PRESS	BEIJING	CHAOYANG DIST, 4, HUIXINDONGJIE, FUSHENG BLDG, BEIJING 100029, PEOPLES R CHINA	1673-3452	1673-3576		FRONT MATH CHINA	Front. Math. China	OCT	2015	10	5					1169	1178		10.1007/s11464-015-0483-x				10	Mathematics	Mathematics	CJ8LC	WOS:000355750900009					2019-08-07	
J	Wang, YJ; Shang, SK; Gao, Y				Wang, Yongjie; Shang, Shikui; Gao, Yun			Color cyclic homology and Steinberg Lie color algebras	FRONTIERS OF MATHEMATICS IN CHINA			English	Article						Steinberg Lie color algebra; epsilon-cyclic homology group; universal central extension	CENTRAL EXTENSIONS; SUPERALGEBRAS	The present paper contains two interrelated developments. First, the basic properties of the construction theory over the Steinberg Lie color algebras are developed in analogy with Steinberg Lie algebra case. This is done on the example of the central closed of the Steinberg Lie color algebras. The second development is that we define the first E >-cyclic homology group HC (1)(R, E >) of the I"-graded associative algebra R (which could be seemed as the generalization of cyclic homology group and the a"currency sign/2a"currency sign-graded version of cyclic homology that was introduced by Kassel) to calculate the universal central extension of Steinberg Lie color algebras.	[Wang, Yongjie; Shang, Shikui; Gao, Yun] Univ Sci & Technol China, Sch Math Sci, Hefei 230026, Peoples R China; [Gao, Yun] York Univ, Dept Math & Stat, Toronto, ON M3J 1P3, Canada	Wang, YJ (reprint author), Univ Sci & Technol China, Sch Math Sci, Hefei 230026, Peoples R China.	wyjie@mail.ustc.edu.cn						12	0	0	0	0	HIGHER EDUCATION PRESS	BEIJING	SHATANHOU ST 55, BEIJING 100009, PEOPLES R CHINA	1673-3452	1673-3576		FRONT MATH CHINA	Front. Math. China	OCT	2015	10	5					1179	1202		10.1007/s11464-015-0468-9				24	Mathematics	Mathematics	CJ8LC	WOS:000355750900010					2019-08-07	
J	Chen, AY; Li, XL; Ku, HM				Chen, Anyue; Li, Xiliu; Ku, HoMing			A new approach in analyzing extinction probability of Markov branching process with immigration and migration	FRONTIERS OF MATHEMATICS IN CHINA			English	Article						Markov branching processes; interaction; extinction probability		We use a new approach to consider the extinction properties of the Markov branching process with immigration and migration recently discussed by Li and Liu [Sci. China Math., 2011, 54: 1043-1062]. Some much better explicit expressions are obtained for the extinction probabilities of the subtle super-interacting case.	[Chen, Anyue; Li, Xiliu] South Univ Sci & Technol China, Dept Financial Math & Financial Engn, Shenzhen 518055, Peoples R China; [Chen, Anyue; Ku, HoMing] Univ Liverpool, Dept Math Sci, Liverpool L69 7ZL, Merseyside, England	Chen, AY (reprint author), South Univ Sci & Technol China, Dept Financial Math & Financial Engn, Shenzhen 518055, Peoples R China.	chenay@sustc.edu.cn						14	0	0	1	8	HIGHER EDUCATION PRESS	BEIJING	SHATANHOU ST 55, BEIJING 100009, PEOPLES R CHINA	1673-3452	1673-3576		FRONT MATH CHINA	Front. Math. China	AUG	2015	10	4					733	751		10.1007/s11464-015-0475-x				19	Mathematics	Mathematics	CJ6SB	WOS:000355622800002					2019-08-07	
J	Chow, YY				Chow, Yunshyong			Evolutionary prisoner's dilemma games with local interaction and best-response dynamics	FRONTIERS OF MATHEMATICS IN CHINA			English	Article						Prisoner's dilemma game; full cooperation; best response; local interaction; long run equilibrium; parallel updating	COOPERATION; ASPIRATIONS; IMITATION	This paper studies the long run behavior in evolutionary prisoner's dilemma games. All players are assumed to sit around a circle and to interact only with their neighbors. It is known that full-defection is the unique long run equilibrium as the probability of players' experimentation (or mutation) tends to zero in the best response dynamics. Here, it is shown that full-cooperation could emerge in the long run if one also cares for his neighbors in the best-response dynamics.	Acad Sinica, Inst Math, Taipei 11529, Taiwan	Chow, YY (reprint author), Acad Sinica, Inst Math, Taipei 11529, Taiwan.	chow@math.sinica.edu.tw						14	0	0	1	3	HIGHER EDUCATION PRESS	BEIJING	SHATANHOU ST 55, BEIJING 100009, PEOPLES R CHINA	1673-3452	1673-3576		FRONT MATH CHINA	Front. Math. China	AUG	2015	10	4					839	856		10.1007/s11464-015-0478-7				18	Mathematics	Mathematics	CJ6SB	WOS:000355622800006					2019-08-07	
J	Fang, SZ; Nolot, V				Fang, Shizan; Nolot, Vincent			Optimal transport maps on infinite dimensional spaces	FRONTIERS OF MATHEMATICS IN CHINA			English	Article						Girsanov theorem; entropy; optimal transport map; Wiener space; Lebesgue point	LOGARITHMIC SOBOLEV INEQUALITIES; MONGE-AMPERE EQUATION; PINNED WIENER MEASURE; METRIC-MEASURE-SPACES; COST INEQUALITIES; POLAR FACTORIZATION; PATH; INVERTIBILITY; MANIFOLDS; EXISTENCE	We will give a survey on results concerning Girsanov transformations, transportation cost inequalities, convexity of entropy, and optimal transport maps on some infinite dimensional spaces. Some open Problems will be arisen.	[Fang, Shizan; Nolot, Vincent] Univ Bourgogne, IMB, Dijon, France	Fang, SZ (reprint author), Univ Bourgogne, IMB, BP 47870, Dijon, France.	fang@u-bourgogne.fr						41	0	0	0	2	HIGHER EDUCATION PRESS	BEIJING	CHAOYANG DIST, 4, HUIXINDONGJIE, FUSHENG BLDG, BEIJING 100029, PEOPLES R CHINA	1673-3452	1673-3576		FRONT MATH CHINA	Front. Math. China	AUG	2015	10	4					715	732		10.1007/s11464-015-0474-y				18	Mathematics	Mathematics	CJ6SB	WOS:000355622800001					2019-08-07	
J	He, H; Li, ZH; Zhou, XW				He, Hui; Li, Zenghu; Zhou, Xiaowen			Branching particle systems in spectrally one-sided L,vy processes	FRONTIERS OF MATHEMATICS IN CHINA			English	Article						Levy process; spectrally one-sided; subordinator; branching particle system; non-local branching; Crump-Mode-Jagers (CMJ) branching process	RANDOM ENVIRONMENT; LEVY PROCESSES; RANDOM-WALK; SUPERPROCESSES; TREES	We investigate the branching structure coded by the excursion above zero of a spectrally positive L,vy process. The main idea is to identify the level of the L,vy excursion as the time and count the number of jumps upcrossing the level. By regarding the size of a jump as the birth site of a particle, we construct a branching particle system in which the particles undergo nonlocal branchings and deterministic spatial motions to the left on the positive half line. A particle is removed from the system as soon as it reaches the origin. Then a measure-valued Borel right Markov process can be defined as the counting measures of the particle system. Its total mass evolves according to a Crump-Mode-Jagers (CMJ) branching process and its support represents the residual life times of those existing particles. A similar result for spectrally negative L,vy process is established by a time reversal approach. Properties of the measure-valued processes can be studied via the excursions for the corresponding L,vy processes.	[He, Hui; Li, Zenghu] Beijing Normal Univ, Sch Math Sci, Lab Math & Complex Syst, Beijing 100875, Peoples R China; [Zhou, Xiaowen] Concordia Univ, Dept Math & Stat, Montreal, PQ H3G 1M8, Canada	He, H (reprint author), Beijing Normal Univ, Sch Math Sci, Lab Math & Complex Syst, Beijing 100875, Peoples R China.	hehui@bnu.edu.cn			National Natural Science Foundation of China [11201030, 11371061]; Fundamental Research Funds for the Central Universities [2013YB59]; Natural Sciences and Engineering Research Council of Canada	Hui He wanted to thank Concordia University for his pleasant stay at Montreal where this work was done. The authors would like to thank Professor Wenming Hong for his enlightening discussion. They also would like to thank Amaury Lambert for suggesting the time reversal treatment of the model in Section 5. This work was supported in part by the National Natural Science Foundation of China (Grant Nos. 11201030, 11371061), the Fundamental Research Funds for the Central Universities (2013YB59), and the Natural Sciences and Engineering Research Council of Canada.		19	0	0	0	1	HIGHER EDUCATION PRESS	BEIJING	NO 4 DEWAI DAJIE, BEIJING 100120, PEOPLES R CHINA	1673-3452	1673-3576		FRONT MATH CHINA	Front. Math. China	AUG	2015	10	4					875	900		10.1007/s11464-015-0473-z				26	Mathematics	Mathematics	CJ6SB	WOS:000355622800008					2019-08-07	
J	Ji, HJ; Shao, JH				Ji, Huijie; Shao, Jinghai			First passage probabilities of one-dimensional diffusion processes	FRONTIERS OF MATHEMATICS IN CHINA			English	Article						Boundary crossing probability; first passage probability; Markov chain; Skorokhod approximation	BOUNDARY CROSSING PROBABILITIES; BROWNIAN-MOTION; APPROXIMATION; DENSITIES	This work is devoted to calculating the first passage probabilities of one-dimensional diffusion processes. For a one-dimensional diffusion process, we construct a sequence of Markov chains so that their absorption probabilities approximate the first passage probability of the given diffusion process. This method is especially useful when dealing with time-dependent boundaries.	[Ji, Huijie; Shao, Jinghai] Beijing Normal Univ, Sch Math Sci, Beijing 100875, Peoples R China; [Ji, Huijie] Shanxi Normal Univ, Coll Math & Comp Sci, Linfen 041000, Peoples R China	Shao, JH (reprint author), Beijing Normal Univ, Sch Math Sci, Beijing 100875, Peoples R China.	shaojh@bnu.edu.cn			National Natural Science Foundation of China [11301030, 11431014]; 985-Project; Beijing Higher Education Young Elite Teacher Project	This work was supported in part by the National Natural Science Foundation of China (Grant Nos. 11301030, 11431014), the 985-Project, and the Beijing Higher Education Young Elite Teacher Project.		18	0	0	0	0	HIGHER EDUCATION PRESS	BEIJING	NO 4 DEWAI DAJIE, BEIJING 100120, PEOPLES R CHINA	1673-3452	1673-3576		FRONT MATH CHINA	Front. Math. China	AUG	2015	10	4					901	916		10.1007/s11464-015-0459-x				16	Mathematics	Mathematics	CJ6SB	WOS:000355622800009					2019-08-07	
J	Li, JP; Huang, XX; Wang, J; Zhang, LN				Li, Junping; Huang, Xiangxiang; Wang, Juan; Zhang, Lina			Recurrence and decay properties of a star-typed queueing model with refusal	FRONTIERS OF MATHEMATICS IN CHINA			English	Article						Generation function; bulk-arrival queue; recurrence; ergodicity; decay parameter; invariant measure	QUASI-STATIONARY DISTRIBUTIONS; DENUMERABLE MARKOV CHAINS; CONTINUOUS-TIME; ERGODICITY	We consider a multiclass service system with refusal and bulk-arrival. The properties regarding recurrence, ergodicity, and decay properties of such model are discussed. The explicit criteria regarding recurrence and ergodicity are obtained. The stationary distribution is given in the ergodic case. Then, the exact value of the decay parameter, denoted by lambda (E) , is obtained in the transient case. The criteria for the lambda (E) -recurrence are also obtained. Finally, the corresponding lambda (E) -invariant vector/measure is considered.	[Li, Junping; Huang, Xiangxiang; Wang, Juan; Zhang, Lina] Cent S Univ, Sch Math & Stat, Changsha 410075, Hunan, Peoples R China	Li, JP (reprint author), Cent S Univ, Sch Math & Stat, Changsha 410075, Hunan, Peoples R China.	jpli@mail.csu.edu.cn			National Natural Sciences Foundation of China [11071259, 11371374]; Research Fund for the Doctoral Program of Higher Education of China [20110162110060]; Fundamental Research Funds for the Central South Universities [2010QYZD001]; Graduate Degree Thesis Innovation Foundation of Hunan Province [CX2011B077]	The authors would like to thank the referees for their valuable suggestions, which have extremely improved this paper. This work was supported by the National Natural Sciences Foundation of China (Grant Nos. 11071259, 11371374), the Research Fund for the Doctoral Program of Higher Education of China (No. 20110162110060), the Fundamental Research Funds for the Central South Universities (No. 2010QYZD001), and the Graduate Degree Thesis Innovation Foundation of Hunan Province (CX2011B077).		19	0	0	0	2	HIGHER EDUCATION PRESS	BEIJING	SHATANHOU ST 55, BEIJING 100009, PEOPLES R CHINA	1673-3452	1673-3576		FRONT MATH CHINA	Front. Math. China	AUG	2015	10	4					917	932		10.1007/s11464-015-0444-4				16	Mathematics	Mathematics	CJ6SB	WOS:000355622800010					2019-08-07	
J	Ma, XC; Xi, FB				Ma, Xiaocui; Xi, Fubao			Large deviations for empirical measures of switching diffusion processes with small parameters	FRONTIERS OF MATHEMATICS IN CHINA			English	Article						Switching diffusion process; empirical measure; large deviation	SYSTEMS; EQUATIONS	We consider the asymptotic property of the diffusion processes with Markovian switching. For a general case, we prove a large deviation principle for empirical measures of switching diffusion processes with small parameters.	[Ma, Xiaocui; Xi, Fubao] Beijing Inst Technol, Sch Math, Beijing 100081, Peoples R China; [Ma, Xiaocui] Jining Univ, Dept Math, Qufu 273155, Peoples R China	Xi, FB (reprint author), Beijing Inst Technol, Sch Math, Beijing 100081, Peoples R China.	xifb@bit.edu.cn			National Natural Science Foundation of China [11171024]	The authors would like to thank the referees for providing many helpful comments and suggestions. Research of the second author was supported in part by the National Natural Science Foundation of China (Grant No. 11171024).		24	0	0	0	0	HIGHER EDUCATION PRESS	BEIJING	SHATANHOU ST 55, BEIJING 100009, PEOPLES R CHINA	1673-3452	1673-3576		FRONT MATH CHINA	Front. Math. China	AUG	2015	10	4					949	963		10.1007/s11464-015-0486-7				15	Mathematics	Mathematics	CJ6SB	WOS:000355622800012					2019-08-07	
J	Ma, YT; Wang, YZ				Ma, Yutao; Wang, Yingzhe			Algebraic convergence of diffusion processes on a"e (n) with radial diffusion and drift coefficients	FRONTIERS OF MATHEMATICS IN CHINA			English	Article						Diffusion processes; algebraic convergence; classical coupling; coupling by reflection; spherically invariant		We consider the diffusion process X (t) on a"e (n) with radial diffusion and drift coefficients. We prove that once the one-dimensional diffusion |X (t) | has algebraic L (2)-convergence, so does X (t) . And some classical examples are discussed.	[Ma, Yutao] Beijing Normal Univ, Sch Math Sci, Beijing 100875, Peoples R China; Beijing Normal Univ, Lab Math & Complex Syst, Minist Educ, Beijing 100875, Peoples R China	Ma, YT (reprint author), Beijing Normal Univ, Sch Math Sci, Beijing 100875, Peoples R China.	mayt@bnu.edu.cn			National Natural Science Foundation of China [11101040, 11371283, 11431014]; YETP0264 Project; 985 Project; Fundamental Research Funds for the Central Universities	This work was supported by the National Natural Science Foundation of China (Grant Nos. 11101040, 11371283, 11431014), YETP0264, 985 Projects, and the Fundamental Research Funds for the Central Universities.		15	0	0	0	0	HIGHER EDUCATION PRESS	BEIJING	CHAOYANG DIST, 4, HUIXINDONGJIE, FUSHENG BLDG, BEIJING 100029, PEOPLES R CHINA	1673-3452	1673-3576		FRONT MATH CHINA	Front. Math. China	AUG	2015	10	4					965	984		10.1007/s11464-015-0476-9				20	Mathematics	Mathematics	CJ6SB	WOS:000355622800013					2019-08-07	
J	Cheng, HY; Cheong, KH				Cheng, Herng Yi; Cheong, Kang Hao			Map composition generalized to coherent collections of maps	FRONTIERS OF MATHEMATICS IN CHINA			English	Article						Relation algebra; partial algebra; composition	INVOLUTION	Relation algebras give rise to partial algebras on maps, which are generalized to partial algebras on polymaps while preserving the properties of relation union and composition. A polymap is defined as a map with every point in the domain associated with a special set of maps. Polymaps can be represented as small subcategories of Set*, the category of pointed sets. Map composition and the counterpart of relation union for maps are generalized to polymap composition and sum. Algebraic structures and categories of polymaps are investigated. Polymaps present the unique perspective of an algebra that can retain many of its properties when its elements (maps) are augmented with collections of other elements.	[Cheng, Herng Yi; Cheong, Kang Hao] Natl Univ Singapore High Sch Math & Sci, Singapore 129957, Singapore; [Cheong, Kang Hao] Tanglin Secondary Sch, Singapore 127391, Singapore	Cheong, KH (reprint author), Natl Univ Singapore High Sch Math & Sci, Singapore 129957, Singapore.	g0800484@nus.edu.sg		Cheong, Kang Hao/0000-0002-4475-5451				17	0	0	0	0	HIGHER EDUCATION PRESS	BEIJING	SHATANHOU ST 55, BEIJING 100009, PEOPLES R CHINA	1673-3452	1673-3576		FRONT MATH CHINA	Front. Math. China	JUN	2015	10	3					547	565		10.1007/s11464-015-0435-5				19	Mathematics	Mathematics	CJ6RY	WOS:000355622500004					2019-08-07	
J	Gan, ZY; Lou, DJ; Zhang, ZB; Wen, XL				Gan, Zhiyong; Lou, Dingjun; Zhang, Zanbo; Wen, Xuelian			Bipartite double cover and perfect 2-matching covered graph with its algorithm	FRONTIERS OF MATHEMATICS IN CHINA			English	Article						Bipartite double cover; perfect 2-matching covered graph; 1-extendable graph; minimally perfect 2-matching covered graph; minimally 1-extendable graph; algorithm		Let B(G) denote the bipartite double cover of a non-bipartite graph G with v >= 2 vertices and epsilon edges. We prove that G is a perfect 2-matching covered graph if and only if B(G) is a 1-extendable graph. Furthermore, we prove that B(G) is a minimally 1-extendable graph if and only if G is a minimally perfect 2-matching covered graph and for each e = xy is an element of E(G), there is an independent set S in G such that vertical bar Gamma(G)(S)vertical bar = vertical bar S vertical bar + 1, x is an element of S and vertical bar Gamma(G-xy)(S)vertical bar = vertical bar S vertical bar. Then, we construct a digraph D from B(G) or G and show that D is a strongly connected digraph if and only if G is a perfect 2-matching covered graph. So we design an algorithm in O(root v epsilon) time that determines whether G is a perfect 2-matching covered graph or not.	[Gan, Zhiyong; Lou, Dingjun] Sun Yat Sen Univ, Dept Comp Sci, Guangzhou 510275, Guangdong, Peoples R China; [Zhang, Zanbo] Guangdong Ind Tech Coll, Dept Comp Engn, Guangzhou 510300, Guangdong, Peoples R China; [Wen, Xuelian] S China Normal Univ, Sch Econ & Management, Guangzhou 510006, Guangdong, Peoples R China	Lou, DJ (reprint author), Sun Yat Sen Univ, Dept Comp Sci, Guangzhou 510275, Guangdong, Peoples R China.	issldj@mail.sysu.edu.cn			National Natural Science Foundation of China [11201158]	The authors would like to thank the referees very much for their careful reading and their very instructive suggestions which improve this paper greatly. This work was supported in part by the National Natural Science Foundation of China (Grant No. 11201158).		15	0	0	0	2	HIGHER EDUCATION PRESS	BEIJING	SHATANHOU ST 55, BEIJING 100009, PEOPLES R CHINA	1673-3452	1673-3576		FRONT MATH CHINA	Front. Math. China	JUN	2015	10	3					621	634		10.1007/s11464-015-0449-z				14	Mathematics	Mathematics	CJ6RY	WOS:000355622500008					2019-08-07	
J	Wang, XH; Hu, SH				Wang, Xinghui; Hu, Shuhe			Conditional mean convergence theorems of conditionally dependent random variables under conditions of integrability	FRONTIERS OF MATHEMATICS IN CHINA			English	Article						Conditional negatively quadrant dependent (NQD) random variable; conditional negatively associated (NA) random variable; conditional mean convergence; conditionally residual h-integrability	CESARO ALPHA-INTEGRABILITY; LARGE NUMBERS; WEAK LAWS; LIMIT-THEOREMS; WEIGHTED SUMS; ARRAYS; DEMIMARTINGALES; ASSOCIATION	We give the conditionally residual h-integrability with exponent r for an array of random variables and establish the conditional mean convergence of conditionally negatively quadrant dependent and conditionally negative associated random variables under this integrability. These results generalize and improve the known ones.	[Wang, Xinghui; Hu, Shuhe] Anhui Univ, Dept Stat, Hefei 230601, Peoples R China	Hu, SH (reprint author), Anhui Univ, Dept Stat, Hefei 230601, Peoples R China.	hushuhe@263.net			National Natural Science Foundation of China [11171001, 11201001, 11426032]; Natural Science Foundation of Anhui Province [1308085QA03, 1408085QA02]; Science Fund for Distinguished Young Scholars of Anhui Province [1508085J06]; Introduction Projects of Anhui University Academic and Technology Leaders	The authors thank Editor Lu and two anonymous referees for their constructive suggestions and comments which helped in significantly improving an earlier version of this paper. This work is supported by the National Natural Science Foundation of China (11171001, 11201001, 11426032), the Natural Science Foundation of Anhui Province (1308085QA03, 1408085QA02), the Science Fund for Distinguished Young Scholars of Anhui Province (1508085J06), and Introduction Projects of Anhui University Academic and Technology Leaders.		23	0	0	0	4	HIGHER EDUCATION PRESS	BEIJING	NO 4 DEWAI DAJIE, BEIJING 100120, PEOPLES R CHINA	1673-3452	1673-3576		FRONT MATH CHINA	Front. Math. China	JUN	2015	10	3					681	696		10.1007/s11464-015-0450-6				16	Mathematics	Mathematics	CJ6RY	WOS:000355622500011					2019-08-07	
J	Wu, MZ				Wu, Mingzhong			Completable nilpotent Lie superalgebras	FRONTIERS OF MATHEMATICS IN CHINA			English	Article						Filiform Lie superalgebra; Heisenberg superalgebra; completable nilpotent Lie superalgebra; maximal torus; complete Lie superalgebra	INFINITESIMAL DEFORMATIONS; ALGEBRAS; CLASSIFICATION	We discuss a class of filiform Lie superalgebras L-n,L-m. From these Lie superalgebras, all the other filiform Lie superalgebras can be obtained by deformations. We have decompositions of Der((0) over bar)(L-n,L-m) and Der((1) over bar)(L-n,L-m). By computing a maximal torus on each L-n,L-m, we show that L-n,L-m are completable nilpotent Lie superalgebras. We also view L-n,L-m as Lie algebras, prove that L-n,L-m are of maximal rank, and show that L-n,L-m are completable nilpotent Lie algebras. As an application of the results, we show a Heisenberg superalgebra is a completable nilpotent Lie superalgebra.	[Wu, Mingzhong] Nankai Univ, Chern Inst Math & LPMC, Tianjin 300071, Peoples R China; [Wu, Mingzhong] China West Normal Univ, Dept Math, Nanchong 637002, Peoples R China	Wu, MZ (reprint author), Nankai Univ, Chern Inst Math & LPMC, Tianjin 300071, Peoples R China.	m.z.wu@163.com						20	0	0	0	0	HIGHER EDUCATION PRESS	BEIJING	SHATANHOU ST 55, BEIJING 100009, PEOPLES R CHINA	1673-3452	1673-3576		FRONT MATH CHINA	Front. Math. China	JUN	2015	10	3					697	713		10.1007/s11464-014-0362-x				17	Mathematics	Mathematics	CJ6RY	WOS:000355622500012					2019-08-07	
