PT	AU	BA	BE	GP	AF	BF	CA	TI	SO	SE	BS	LA	DT	CT	CY	CL	SP	HO	DE	ID	AB	C1	RP	EM	RI	OI	FU	FX	CR	NR	TC	Z9	U1	U2	PU	PI	PA	SN	EI	BN	J9	JI	PD	PY	VL	IS	PN	SU	SI	MA	BP	EP	AR	DI	D2	EA	EY	PG	WC	SC	GA	UT	PM	OA	HC	HP	DA	
J	Chen, MF; Wang, LD; Zhang, YH				Chen, Mu-Fa; Wang, Lingdi; Zhang, Yuhui			Mixed eigenvalues of p-Laplacian	FRONTIERS OF MATHEMATICS IN CHINA			English	Article						p-Laplacian; Hardy inequality in L-p space; mixed boundaries; explicit estimates; eigenvalue; approximating procedure		The mixed principal eigenvalue of p -Laplacian (equivalently, the optimal constant of weighted Hardy inequality in L (p) space) is studied in this paper. Several variational formulas for the eigenvalue are presented. As applications of the formulas, a criterion for the positivity of the eigenvalue is obtained. Furthermore, an approximating procedure and some explicit estimates are presented case by case. An example is included to illustrate the power of the results of the paper.	[Chen, Mu-Fa; Wang, Lingdi; Zhang, Yuhui] Beijing Normal Univ, Sch Math Sci, Beijing 100875, Peoples R China; [Wang, Lingdi] Henan Univ, Sch Math & Informat Sci, Kaifeng 475004, Peoples R China	Wang, LD (reprint author), Beijing Normal Univ, Sch Math Sci, Beijing 100875, Peoples R China.	wanglingdi@henu.edu.cn			National Natural Science Foundation of China [11131003]; Specialized Research Fund for the Doctoral Program of Higher Education [20100003110005]; '985' project from the Ministry of Education in China; Fundamental Research Funds for the Central Universities	The authors would like to thank Professor Yonghua Mao for his helpful comments and suggestions. This work was supported in part by the National Natural Science Foundation of China (Grant No. 11131003), the Specialized Research Fund for the Doctoral Program of Higher Education (Grant No. 20100003110005), the '985' project from the Ministry of Education in China, and the Fundamental Research Funds for the Central Universities.		13	1	2	0	0	HIGHER EDUCATION PRESS	BEIJING	CHAOYANG DIST, 4, HUIXINDONGJIE, FUSHENG BLDG, BEIJING 100029, PEOPLES R CHINA	1673-3452	1673-3576		FRONT MATH CHINA	Front. Math. China	APR	2015	10	2					249	274		10.1007/s11464-015-0375-0				26	Mathematics	Mathematics	CB3UH	WOS:000349554000002					2019-08-07	
J	Li, LC; Li, XW				Li, Liangchen; Li, Xiangwen			Nowhere-zero 3-flows in Cayley graphs on generalized dihedral group and generalized quaternion group	FRONTIERS OF MATHEMATICS IN CHINA			English	Article						Nowhere-zero 3-flow; Cayley graph; generalized dihedral group; generalized quaternion group	GROUP CONNECTIVITY	Tutte conjectured that every 4-edge-connected graph admits a nowhere-zero 3-flow. In this paper, we show that this conjecture is true for Cayley graph on generalized dihedral groups and generalized quaternion groups, which generalizes the result of F. Yang and X. Li [Inform. Process. Lett., 2011, 111: 416-419]. We also generalizes an early result of M. Nanasiova and M. koviera [J. Algebraic Combin., 2009, 30: 103-110].	[Li, Liangchen; Li, Xiangwen] Huazhong Normal Univ, Dept Math, Wuhan 430079, Peoples R China; [Li, Liangchen] Luoyang Normal Univ, Dept Math, Luoyang 471022, Peoples R China	Li, XW (reprint author), Huazhong Normal Univ, Dept Math, Wuhan 430079, Peoples R China.	xwli68@mail.ccnu.edu.cn			Natural Science Foundation of China [11301254]; Natural Science Foundation of Henan Province [132300410313]; Natural Science Foundation of Education Bureau of Henan Province [13A110800]; National Natural Science Foundation of China [11171129]; Doctoral Fund of Ministry of Education of China [20130144110001]	The first author was supported by the Natural Science Foundation of China (Grant No. 11301254), the Natural Science Foundation of Henan Province (Grant No. 132300410313), and the Natural Science Foundation of Education Bureau of Henan Province (Grant No. 13A110800). The second author was supported by the National Natural Science Foundation of China (Grant No. 11171129) and the Doctoral Fund of Ministry of Education of China (Grant No. 20130144110001).		20	1	1	1	4	HIGHER EDUCATION PRESS	BEIJING	SHATANHOU ST 55, BEIJING 100009, PEOPLES R CHINA	1673-3452	1673-3576		FRONT MATH CHINA	Front. Math. China	APR	2015	10	2					293	302		10.1007/s11464-014-0378-2				10	Mathematics	Mathematics	CB3UH	WOS:000349554000004					2019-08-07	
J	Zhang, W; Zhao, WD				Zhang, Wei; Zhao, Weidong			Euler-type schemes for weakly coupled forward-backward stochastic differential equations and optimal convergence analysis	FRONTIERS OF MATHEMATICS IN CHINA			English	Article						Weakly coupled forward-backward stochastic differential equations (FBSDEs); Euler-type scheme; time discretization; first-order; error estimate	QUASI-LINEAR PDES; NUMERICAL-METHOD; THETA-SCHEME; ALGORITHM	We introduce a new Euler-type scheme and its iterative algorithm for solving weakly coupled forward-backward stochastic differential equations (FBSDEs). Although the schemes share some common features with the ones proposed by C. Bender and J. Zhang [Ann. Appl. Probab., 2008, 18: 143-177], less computational work is needed for our method. For both our schemes and the ones proposed by Bender and Zhang, we rigorously obtain first-order error estimates, which improve the half-order error estimates of Bender and Zhang. Moreover, numerical tests are given to demonstrate the first-order accuracy of the schemes.	[Zhang, Wei; Zhao, Weidong] Shandong Univ, Finance Inst, Sch Math, Jinan 250100, Peoples R China	Zhao, WD (reprint author), Shandong Univ, Finance Inst, Sch Math, Jinan 250100, Peoples R China.	wdzhao@sdu.edu.cn			National Natural Science Foundations of China [91130003, 11171189]; Natural Science Foundation of Shandong Province [ZR2011AZ002]	The authors would like to thank the referees for the valuable comments, which improved the paper a lot. This work was partially supported by the National Natural Science Foundations of China (Grant Nos. 91130003, 11171189) and the Natural Science Foundation of Shandong Province (No. ZR2011AZ002).		35	1	2	0	0	HIGHER EDUCATION PRESS	BEIJING	SHATANHOU ST 55, BEIJING 100009, PEOPLES R CHINA	1673-3452	1673-3576		FRONT MATH CHINA	Front. Math. China	APR	2015	10	2					415	434		10.1007/s11464-014-0366-6				20	Mathematics	Mathematics	CB3UH	WOS:000349554000012					2019-08-07	
J	Jara, P				Jara, Pascual			Nagata rings	FRONTIERS OF MATHEMATICS IN CHINA			English	Article						Cohen-Macaulay; Gorenstein; Krull; Nagata rings	SEMISTAR OPERATIONS	Let A be a commutative ring. For any set P of prime ideals of A, we define a new ring Na(A,P): the Nagata ring. This new ring has the particularity that we may transform certain properties relative to P to properties on the whole ring Na(A,P); some of these properties are: ascending chain condition, Krull dimension, Cohen-Macaulay, Gorenstein. Our main aim is to show that most of the above properties relative to a set of prime ideals P (i.e., local properties) determine and are determined by the same properties on the Nagata ring (i.e., global properties). In order to look for new applications, we show that this construction is functorial, and exhibits a functorial embedding from the localized category (A,P)-Mod into the module category Na(A,P)-Mod.	Univ Granada, Dept Algebra, E-18071 Granada, Spain	Jara, P (reprint author), Univ Granada, Dept Algebra, E-18071 Granada, Spain.	pjara@ugr.es			Junta de Andalucia Research Group [FQM-266];  [MTM2010-20940-C02-01]	This work was supported by FQM-266 (Junta de Andalucia Research Group) and MTM2010-20940-C02-01.		16	1	1	0	0	HIGHER EDUCATION PRESS	BEIJING	NO 4 DEWAI DAJIE, BEIJING 100120, PEOPLES R CHINA	1673-3452	1673-3576		FRONT MATH CHINA	Front. Math. China	FEB	2015	10	1					91	110		10.1007/s11464-014-0388-0				20	Mathematics	Mathematics	AW3DI	WOS:000346165300005					2019-08-07	
J	Cheng, YS; Zhang, XF				Cheng, Yongsheng; Zhang, Xiufu			Representations and categorical realization of Hom-quasi-Hopf algebras	FRONTIERS OF MATHEMATICS IN CHINA			English	Article						Monoidal category; Hom-coassociative 2-coalgebra; Hom-quasi-Hopf algebra	QUANTUM-FIELD THEORY; LIE-ALGEBRAS; CATEGORIFICATION	We give a monoidal category approach to Hom-coassociative coalgebra by imposing the Hom-coassociative law up to some isomorphisms on the comultiplication map and requiring that these isomorphisms satisfy the copentagon axiom and obtain a Hom-coassociative 2-coalgebra, which is a 2-category. Second, we characterize Hom-bialgebras in terms of their categories of modules. Finally, we give a categorical realization of Hom-quasi-Hopf algebras using Hom-coassociative 2-coalgebra.	[Cheng, Yongsheng] Henan Univ, Sch Math & Stat, Kaifeng 475004, Peoples R China; [Cheng, Yongsheng] Henan Univ, Inst Contemporary Math, Kaifeng 475004, Peoples R China; [Zhang, Xiufu] Jiangsu Normal Univ, Sch Math & Stat, Xuzhou 221116, Peoples R China	Cheng, YS (reprint author), Henan Univ, Sch Math & Stat, Kaifeng 475004, Peoples R China.	yscheng@ustc.edu.cn		Cheng, Yongsheng/0000-0002-6031-5747	National Natural Science Foundation of China [11047030, 11171055, 11571145]; Science and Technology Program of Henan Province [152300410061]	The authors would like to thank the referees for a number of helpful comments that greatly improved the presentation of this paper. The first author also thanks Prof. Ke Wu and Prof. Shikun Wang for stimulating discussion and help in preparation of this paper. This work was supported in part by the National Natural Science Foundation of China (Grant Nos. 11047030, 11171055, 11571145) and the Science and Technology Program of Henan Province (No. 152300410061).		20	0	0	0	10	HIGHER EDUCATION PRESS	BEIJING	SHATANHOU ST 55, BEIJING 100009, PEOPLES R CHINA	1673-3452	1673-3576		FRONT MATH CHINA	Front. Math. China	DEC	2015	10	6					1263	1281		10.1007/s11464-015-0460-4				19	Mathematics	Mathematics	CS3ZF	WOS:000362013600001					2019-08-07	
J	Hong, WM; Yang, H; Zhou, K				Hong, Wenming; Yang, Hui; Zhou, Ke			Scaling limit of local time of Sinai's random walk	FRONTIERS OF MATHEMATICS IN CHINA			English	Article						Sinai's random walk; random environment; local time; Brox's diffusion; branching process	RANDOM ENVIRONMENT; BRANCHING-PROCESSES; 1/F NOISE; DIFFUSION	We prove that the local times of a sequence of Sinai's random walks converge to those of Brox's diffusion by proper scaling. Our proof is based on the intrinsic branching structure of the random walk and the convergence of the branching processes in random environment.	[Hong, Wenming; Yang, Hui] Beijing Normal Univ, Sch Math Sci, Beijing 100875, Peoples R China; [Hong, Wenming; Yang, Hui] Beijing Normal Univ, Lab Math & Complex Syst, Beijing 100875, Peoples R China; [Zhou, Ke] Univ Int Business & Econ, Sch Stat, Beijing 100029, Peoples R China	Yang, H (reprint author), Beijing Normal Univ, Sch Math Sci, Beijing 100875, Peoples R China.	yanghui2011@mail.bnu.edu.cn			National Natural Science Foundation of China [10721091]; 985-project	The authors thank the anonymous referees for their very careful reading of the manuscript. This work was supported in part by the National Natural Science Foundation of China (Grant No. 10721091) and the 985-project.		19	0	0	0	0	HIGHER EDUCATION PRESS	BEIJING	SHATANHOU ST 55, BEIJING 100009, PEOPLES R CHINA	1673-3452	1673-3576		FRONT MATH CHINA	Front. Math. China	DEC	2015	10	6					1313	1324		10.1007/s11464-015-0485-8				12	Mathematics	Mathematics	CS3ZF	WOS:000362013600003					2019-08-07	
J	Hou, F				Hou, Fei			Oscillations of coefficients of symmetric square L-functions over primes	FRONTIERS OF MATHEMATICS IN CHINA			English	Article						symmetric-square L-function; primitive holomorphic cusp form; Fourier coefficient	FOURIER COEFFICIENTS; CUSP FORMS; SUMS	Let L(s, sym(2) f) be the symmetric-square L-function associated to a primitive holomorphic cusp form f for SL(2,a"currency sign), with t (f) (n, 1) denoting the nth coefficient of the Dirichlet series for it. It is proved that, for N a (c) 3/4 2 and any alpha a a"e, there exists an effective positive constant c such that I pound (na (c) 1/2N) I >(n)t (f) (n, 1)e(n alpha) a parts per thousand(a) N , where I >(n) is the von Mangoldt function, and the implied constant only depends on f. We also study the analogue of Vinogradov's three primes theorem associated to the coefficients of Rankin-Selberg L-functions.	Shandong Univ, Sch Math, Jinan 250100, Peoples R China	Hou, F (reprint author), Shandong Univ, Sch Math, Jinan 250100, Peoples R China.	feihou.prc@gmail.com						12	0	0	0	0	HIGHER EDUCATION PRESS	BEIJING	SHATANHOU ST 55, BEIJING 100009, PEOPLES R CHINA	1673-3452	1673-3576		FRONT MATH CHINA	Front. Math. China	DEC	2015	10	6					1325	1341		10.1007/s11464-015-0442-6				17	Mathematics	Mathematics	CS3ZF	WOS:000362013600004					2019-08-07	
J	Hou, JF; Wu, SF				Hou, Jianfeng; Wu, Shufei			Acyclic coloring of graphs without bichromatic long path	FRONTIERS OF MATHEMATICS IN CHINA			English	Article						Coloring; acyclic; path; entropy compression	SPARSE HESSIAN MATRICES; PLANAR GRAPHS	Let G be a graph of maximum degree Delta. A proper vertex coloring of G is acyclic if there is no bichromatic cycle. It was proved by Alon et al. [Acyclic coloring of graphs. Random Structures Algorithms, 1991, 2(3): 277-288] that G admits an acyclic coloring with O(Delta(4/3)) colors and a proper coloring with O(Delta((k-1)/(k-2))) colors such that no path with k vertices is bichromatic for a fixed integer k a parts per thousand yen 5. In this paper, we combine above two colorings and show that if k a parts per thousand yen 5 and G does not contain cycles of length 4, then G admits an acyclic coloring with O(Delta((k-1)/(k-2))) colors such that no path with k vertices is bichromatic.	[Hou, Jianfeng; Wu, Shufei] Fuzhou Univ, Ctr Discrete Math, Fuzhou 350003, Peoples R China	Wu, SF (reprint author), Fuzhou Univ, Ctr Discrete Math, Fuzhou 350003, Peoples R China.	shufeiwu@hotmail.com	Wu, Shufei/M-9551-2016	Wu, Shufei/0000-0002-7541-7375	National Natural Science Foundation of China [11331003]	The authors would like to thank the referees for providing some very helpful suggestions for revising this paper. This work was supported in part by the National Natural Science Foundation of China (Grant No. 11331003).		19	0	0	0	12	HIGHER EDUCATION PRESS	BEIJING	NO 4 DEWAI DAJIE, BEIJING 100120, PEOPLES R CHINA	1673-3452	1673-3576		FRONT MATH CHINA	Front. Math. China	DEC	2015	10	6					1343	1354		10.1007/s11464-015-0497-4				12	Mathematics	Mathematics	CS3ZF	WOS:000362013600005					2019-08-07	
J	Jia, RL; Jiang, MY				Jia, Ruiling; Jiang, Meiyue			Minimizers of anisotropic Rudin-Osher-Fatemi models	FRONTIERS OF MATHEMATICS IN CHINA			English	Article						Anisotropic Rudin-Osher-Fatemi (ROF) model; Euler-Lagrange equation; phi-curvature	1-LAPLACE OPERATOR; ALGORITHMS	We give the explicit formulas of the minimizers of the anisotropic Rudin-Osher-Fatemi models Equ1 <MediaObject> </MediaObject> </Equation> where Omega aS, a"e(2) is a domain, I center dot (o) is an anisotropic norm on a"e(2), and f is a solution of the anisotropic 1-Laplacian equations.	[Jia, Ruiling; Jiang, Meiyue] Peking Univ, Sch Math Sci, LMAM, Beijing 100871, Peoples R China	Jiang, MY (reprint author), Peking Univ, Sch Math Sci, LMAM, Beijing 100871, Peoples R China.	mjiang@math.pku.edu.cn			National Natural Science Foundation of China [11271025, 11371038, 11431001]	The authors thank the referees for careful reading of the paper and useful suggestions which improve the presentation. This work was supported by the National Natural Science Foundation of China (Grant Nos. 11271025, 11371038, 11431001).		19	0	0	0	0	HIGHER EDUCATION PRESS	BEIJING	SHATANHOU ST 55, BEIJING 100009, PEOPLES R CHINA	1673-3452	1673-3576		FRONT MATH CHINA	Front. Math. China	DEC	2015	10	6					1355	1388		10.1007/s11464-015-0489-4				34	Mathematics	Mathematics	CS3ZF	WOS:000362013600006					2019-08-07	
J	Liang, J; Zhang, XD; Zhao, YJ				Liang, Jin; Zhang, Xudan; Zhao, Yuejuan			Utility indifference valuation of corporate bond with rating migration risk	FRONTIERS OF MATHEMATICS IN CHINA			English	Article						Utility indifference price; credit rating migration; HJB equation; Markov-modulated	PORTFOLIO OPTIMIZATION; CREDIT DERIVATIVES	A pricing model for a corporate bond with rating migration risk is established in this article. With the technology of utility-indifference valuation under the Markov-modulated framework, we analyze the price of a multi-rating bond and obtain closed formulae in a three-rating case. Based on the pricing formulae, the impacts of the parameters on the indifference price are analyzed and some reasonable financial explanations are provided as well.	[Liang, Jin; Zhang, Xudan; Zhao, Yuejuan] Tongji Univ, Dept Math, Shanghai 200092, Peoples R China	Zhang, XD (reprint author), Tongji Univ, Dept Math, Shanghai 200092, Peoples R China.	may8705105@126.com			National Natural Science Foundation of China [11271287]	This work was supported by the National Natural Science Foundation of China (Grant No. 11271287).		13	0	0	0	0	HIGHER EDUCATION PRESS	BEIJING	NO 4 DEWAI DAJIE, BEIJING 100120, PEOPLES R CHINA	1673-3452	1673-3576		FRONT MATH CHINA	Front. Math. China	DEC	2015	10	6					1389	1400		10.1007/s11464-015-0445-3				12	Mathematics	Mathematics	CS3ZF	WOS:000362013600007					2019-08-07	
J	Sun, GK; Zhang, SQ; Liu, GX				Sun, Guangkun; Zhang, Shuaiqi; Liu, Guoxin			Ruin probability in Sparre Andersen risk model with claim inter-arrival times distributed as Erlang	FRONTIERS OF MATHEMATICS IN CHINA			English	Article						Sparre Andersen risk model; Erlang inter-claim times; ruin probability; Lundberg bound; Cramer-Lundberg approximation		This article deals with the ruin probability in a Sparre Andersen risk process with the inter-claim times being Erlang distributed in the framework of piecewise deterministic Markov process (PDMP). We construct an exponential martingale by virtue of the extended generator of the PDMP to change the measure. Some results are derived for the ruin probabilities, such as the general expressions for ruin probability, Lundberg bounds, Cram,r-Lundberg approximations, and finite-horizon ruin probability.	[Sun, Guangkun] Hebei Univ Technol, Sch Sci, Tianjin 300401, Peoples R China; [Zhang, Shuaiqi] Guangdong Univ Technol, Sch Econ & Commerce, Guangzhou 510520, Guangdong, Peoples R China; [Liu, Guoxin] Shijiazhuang Tiedao Univ, Dept Math, Shijiazhuang 050043, Peoples R China	Sun, GK (reprint author), Hebei Univ Technol, Sch Sci, Tianjin 300401, Peoples R China.	g.k.sun@163.com; shuaiqiz@hotmail.com			National Natural Science Foundation of China [11471218]; Natural Science Foundation of Hebei Province [A2014202202]	This work was supported in part by the National Natural Science Foundation of China (Grant No. 11471218) and the Natural Science Foundation of Hebei Province (No. A2014202202).		9	0	0	1	9	HIGHER EDUCATION PRESS	BEIJING	SHATANHOU ST 55, BEIJING 100009, PEOPLES R CHINA	1673-3452	1673-3576		FRONT MATH CHINA	Front. Math. China	DEC	2015	10	6					1433	1447		10.1007/s11464-015-0492-9				15	Mathematics	Mathematics	CS3ZF	WOS:000362013600010					2019-08-07	
J	Chen, JR; Zhao, ZH				Chen, Jiangrong; Zhao, Zhonghua			A fundamental representation of quantum generalized Kac-Moody algebras with one imaginary simple root	FRONTIERS OF MATHEMATICS IN CHINA			English	Article						Quantum generalized Kac-Moody algebra; tensor algebra; fundamental representation	ENVELOPING-ALGEBRAS; SUPERALGEBRAS; DEFORMATIONS; MODULES	We consider the Borcherds-Cartan matrix obtained from a symmetrizable generalized Cartan matrix by adding one imaginary simple root. We extend the result of Gebert and Teschner [Lett. Math. Phys., 1994, 31: 327-334] to the quantum case. Moreover, we give a connection between the irreducible dominant representations of quantum Kac-Moody algebras and those of quantum generalized Kac-Moody algebras. As the result, a large class of irreducible dominant representations of quantum generalized Kac-Moody algebras were obtained from representations of quantum Kac-Moody algebras through tensor algebras.	[Chen, Jiangrong] Capital Univ Econ & Business, Sch Stat, Beijing 100070, Peoples R China; [Zhao, Zhonghua] Beijing Univ Chem Technol, Dept Math & Comp Sci, Sch Sci, Beijing 100029, Peoples R China	Zhao, ZH (reprint author), Beijing Univ Chem Technol, Dept Math & Comp Sci, Sch Sci, Beijing 100029, Peoples R China.	zhaozh@mail.buct.edu.cn			National Natural Science Foundation of China [11226063]; Fundamental Research Funds for the Central Universities	The authors would like to thank the referees for many helpful suggestions and express their sincere gratitude to Professor Bangming Deng for many valuable discussion. The second author (Zhao) was partially supported by the National Natural Science Foundation of China (Grant No. 11226063) and the Fundamental Research Funds for the Central Universities.		14	0	0	0	0	HIGHER EDUCATION PRESS	BEIJING	SHATANHOU ST 55, BEIJING 100009, PEOPLES R CHINA	1673-3452	1673-3576		FRONT MATH CHINA	Front. Math. China	OCT	2015	10	5					1041	1056		10.1007/s11464-015-0471-1				16	Mathematics	Mathematics	CJ8LC	WOS:000355750900002					2019-08-07	
J	Chen, XJ; Her, HL; Sun, SZ				Chen, Xiaojun; Her, Hai-Long; Sun, Shanzhong			Lie bialgebra structure on cyclic cohomology of Fukaya categories	FRONTIERS OF MATHEMATICS IN CHINA			English	Article						Fukaya category; cyclic cohomology; Lie bialgebra	NONCOMMUTATIVE SYMPLECTIC-GEOMETRY; COTANGENT BUNDLES; BAR COMPLEX; ALGEBRAS; QUIVER	Let M be an exact symplectic manifold with contact type boundary such that c (1)(M) = 0. Motivated by noncommutative symplectic geometry and string topology, we show that the cyclic cohomology of the Fukaya category of M has an involutive Lie bialgebra structure.	[Chen, Xiaojun] Sichuan Univ, Dept Math, Chengdu 610064, Peoples R China; [Her, Hai-Long] Nanjing Normal Univ, Sch Math Sci, Nanjing 210023, Jiangsu, Peoples R China; [Sun, Shanzhong] Capital Normal Univ, Dept Math, Beijing 100048, Peoples R China; [Sun, Shanzhong] Beijing Ctr Math & Informat Interdisciplinary Sci, Beijing 100048, Peoples R China	Sun, SZ (reprint author), Capital Normal Univ, Dept Math, Beijing 100048, Peoples R China.	sunsz@cnu.edu.cn			National Natural Science Foundation of China [10901084, 10731080, 11131004, 11271269]; Institute of Mathematics and Interdisciplinary Science at Capital Normal University;  [PHR201106118]	The authors would like to thank the referees for pointing out several errors and imprecisions and Professors Yiming Long, Yongbin Ruan and Gang Tian for their helpful communications and supports during these years. H. -L. Her was partially supported by the National Natural Science Foundation of China (Grant No. 10901084); S. Sun was partially supported by the National Natural Science Foundation of China (Grant Nos. 10731080, 11131004), PHR201106118, and the Institute of Mathematics and Interdisciplinary Science at Capital Normal University; all authors are also partially supported by the National Natural Science Foundation of China (Grant No. 11271269).		27	0	1	0	7	HIGHER EDUCATION PRESS	BEIJING	SHATANHOU ST 55, BEIJING 100009, PEOPLES R CHINA	1673-3452	1673-3576		FRONT MATH CHINA	Front. Math. China	OCT	2015	10	5					1057	1085		10.1007/s11464-015-0440-8				29	Mathematics	Mathematics	CJ8LC	WOS:000355750900003					2019-08-07	
J	Hu, YJ; Zhan, XZ; Chen, GN				Hu, Yongjian; Zhan, Xuzhou; Chen, Gongning			An extended version of Schur-Cohn-Fujiwara theorem in stability theory	FRONTIERS OF MATHEMATICS IN CHINA			English	Article						Inertia of polynomial; inertia of matrix; Bezout matrix; Schur-Cohn-Fujiwara theorem; Schur-Cohn matrix	POLYNOMIALS; MATRICES	This paper is concerned with root localization of a complex polynomial with respect to the unit circle in the more general case. The classical Schur-Cohn-Fujiwara theorem converts the inertia problem of a polynomial to that of an appropriate Hermitian matrix under the condition that the associated Bezout matrix is nonsingular. To complete it, we discuss an extended version of the Schur-Cohn-Fujiwara theorem to the singular case of that Bezout matrix. Our method is mainly based on a perturbation technique for a Bezout matrix. As an application of these results and methods, we further obtain an explicit formula for the number of roots of a polynomial located on the upper half part of the unit circle as well.	[Hu, Yongjian; Zhan, Xuzhou; Chen, Gongning] Beijing Normal Univ, Sch Math Sci, Beijing 100875, Peoples R China	Hu, YJ (reprint author), Beijing Normal Univ, Sch Math Sci, Beijing 100875, Peoples R China.	yongjian@bnu.edu.cn			National Natural Science Foundation of China [11071017, 11271045]; Program for New Century Excellent Talents in University	This work was supported by the National Natural Science Foundation of China (Nos. 11071017, 11271045) and the Program for New Century Excellent Talents in University.		12	0	0	1	5	HIGHER EDUCATION PRESS	BEIJING	SHATANHOU ST 55, BEIJING 100009, PEOPLES R CHINA	1673-3452	1673-3576		FRONT MATH CHINA	Front. Math. China	OCT	2015	10	5					1113	1122		10.1007/s11464-015-0453-3				10	Mathematics	Mathematics	CJ8LC	WOS:000355750900006					2019-08-07	
